{
  "$schema": "https://json-schema.org/draft/2020-12/schema",
  "$id": "https://agentbridge.dev/schemas/v1/session.schema.json",
  "$ref": "#/$defs/Session",
  "$defs": {
    "HarnessIdentity": {
      "type": "object",
      "properties": {
        "id": {
          "type": "string"
        },
        "name": {
          "type": "string"
        },
        "version": {
          "type": "string"
        }
      },
      "required": [
        "id",
        "name"
      ],
      "additionalProperties": true
    },
    "SessionRelationship": {
      "type": "object",
      "properties": {
        "type": {
          "type": "string",
          "enum": [
            "parent",
            "child",
            "resume",
            "fork",
            "delegate",
            "related"
          ]
        },
        "from": {
          "type": "string",
          "description": "Canonical session ID: `<harnessId>:<nativeId>`, subagents `<harnessId>:<parentNativeId>/<suffix>`."
        },
        "to": {
          "type": "string",
          "description": "Canonical session ID: `<harnessId>:<nativeId>`, subagents `<harnessId>:<parentNativeId>/<suffix>`."
        }
      },
      "required": [
        "type",
        "from",
        "to"
      ],
      "additionalProperties": true
    },
    "SessionCapabilities": {
      "type": "object",
      "properties": {
        "history": {
          "type": "boolean"
        },
        "live": {
          "type": "boolean"
        },
        "resume": {
          "type": "boolean"
        },
        "toolCalls": {
          "type": "boolean"
        },
        "toolResults": {
          "type": "boolean"
        },
        "reasoning": {
          "type": "boolean"
        },
        "tokenUsage": {
          "type": "boolean"
        },
        "fileEvents": {
          "type": "boolean"
        },
        "commandEvents": {
          "type": "boolean"
        }
      },
      "required": [
        "history",
        "live",
        "resume",
        "toolCalls",
        "toolResults",
        "reasoning",
        "tokenUsage",
        "fileEvents",
        "commandEvents"
      ],
      "additionalProperties": true
    },
    "Session": {
      "type": "object",
      "properties": {
        "id": {
          "type": "string",
          "description": "Canonical session ID: `<harnessId>:<nativeId>`, subagents `<harnessId>:<parentNativeId>/<suffix>`."
        },
        "harness": {
          "$ref": "#/$defs/HarnessIdentity"
        },
        "status": {
          "type": "string",
          "enum": [
            "running",
            "completed",
            "failed",
            "cancelled",
            "unknown"
          ]
        },
        "title": {
          "type": "string"
        },
        "projectPath": {
          "type": "string"
        },
        "workspacePath": {
          "type": "string"
        },
        "parentSessionId": {
          "type": "string",
          "description": "Canonical session ID: `<harnessId>:<nativeId>`, subagents `<harnessId>:<parentNativeId>/<suffix>`."
        },
        "agentLabel": {
          "type": "string"
        },
        "startedAt": {
          "type": "string",
          "pattern": "^(\\d{4})-(\\d{2})-(\\d{2})T(\\d{2}):(\\d{2}):(\\d{2})(\\.\\d+)?(Z|[+-](\\d{2}):(\\d{2}))$",
          "format": "date-time",
          "description": "RFC 3339 timestamp, UTC recommended."
        },
        "endedAt": {
          "type": "string",
          "pattern": "^(\\d{4})-(\\d{2})-(\\d{2})T(\\d{2}):(\\d{2}):(\\d{2})(\\.\\d+)?(Z|[+-](\\d{2}):(\\d{2}))$",
          "format": "date-time",
          "description": "RFC 3339 timestamp, UTC recommended."
        },
        "updatedAt": {
          "type": "string",
          "pattern": "^(\\d{4})-(\\d{2})-(\\d{2})T(\\d{2}):(\\d{2}):(\\d{2})(\\.\\d+)?(Z|[+-](\\d{2}):(\\d{2}))$",
          "format": "date-time",
          "description": "RFC 3339 timestamp, UTC recommended."
        },
        "relationships": {
          "type": "array",
          "items": {
            "$ref": "#/$defs/SessionRelationship"
          }
        },
        "capabilities": {
          "$ref": "#/$defs/SessionCapabilities"
        },
        "metadata": {
          "type": "object"
        }
      },
      "required": [
        "id",
        "harness",
        "status",
        "capabilities",
        "metadata"
      ],
      "additionalProperties": true,
      "title": "Bridge Session"
    }
  }
}
